{
  "schema": "operation_inventory_v2",
  "contract_version": "2.0.0",
  "inventory_id": "super-compound.local.reference",
  "project_config_digest": "sha256:67727ba523cdd472d09b963ca8b7bf483e4a30aa08e48ed85a9b4de819966a3d",
  "background_aggregate_policy": {
    "max_workers": 2,
    "max_reserved_tokens": null,
    "max_reserved_runtime_ms": 21600000,
    "max_remote_calls": 0,
    "max_reviewers": 2
  },
  "issued_at": "2026-07-21T22:30:00.000Z",
  "expires_at": "9999-12-31T23:59:59.999Z",
  "operations": []
}
